{
  "chapter_id": "ch1",
  "title": "Ancient Egypt: Tale 1",
  "tone_profile": "entertaining",
  "sections": [
    {
      "heading": "The Setup",
      "paragraphs": [
        "It started as an ordinary day, which is how trouble prefers to arrive.",
        "Nefru was a market seller in Ancient Egypt, and that day they bargained into a small problem that refused to stay small.",
        "The scene unfolded on a small boat drifting between villages, where ordinary errands can turn into memorable moments."
      ]
    },
    {
      "heading": "The Twist",
      "paragraphs": [
        "It began with a message delivered to the wrong person.",
        "The seal became the center of attention, not because it was expensive, but because it was symbolic.",
        "Nefru followed a trail of small clues—glances, pauses, and one conversation that sounded innocent until it wasn’t."
      ]
    },
    {
      "heading": "The Close",
      "paragraphs": [
        "In the end, the solution was a clever trade that saves face for everyone.",
        "By the time everyone laughed, the problem had already been solved."
      ]
    }
  ]
}